76_3	important literary elements difference important literary elements literary devices genre
76_4	important literary elements genre important
76_5	important literary elements important trope
76_6	important literary elements trope important examples fantasy
76_7	important literary elements important examples fantasy definition allegory
76_8	important literary elements definition allegory important modern
76_9	important literary elements important modern types foreshadowing
76_10	important literary elements types foreshadowing null
77_1	difference soup stew
77_2	difference soup stew chilli stew
77_3	difference soup stew chilli stew goulash
77_4	difference soup stew goulash popular france
77_5	difference soup stew popular france cassoulet made
77_6	difference soup stew cassoulet made cassoulet cassoulet significance
77_7	difference soup stew cassoulet cassoulet significance similar cassoulet
77_8	difference soup stew similar cassoulet cassoulet stew
77_9	difference soup stew cassoulet stew important
77_10	difference soup stew important history irish stew
78_1	keto diet
78_2	keto diet keto diet original developed
78_3	keto diet keto diet original developed ketosis
78_4	keto diet ketosis paleo
78_5	keto diet paleo common
78_6	keto diet common null
78_7	keto diet null intermittent fasting
78_8	keto diet intermittent fasting keto diet related keto
78_9	keto diet keto diet related keto keto diet
78_10	keto diet keto diet weight loss
79_1	taught sociology
79_2	taught sociology main contribution auguste comte
79_3	taught sociology main contribution auguste comte role auguste comte auguste comte
79_4	taught sociology role auguste comte auguste comte herbert spencer
79_5	taught sociology herbert spencer herbert spencer work related auguste comte
79_6	taught sociology herbert spencer work related auguste comte auguste comte
79_7	taught sociology auguste comte auguste comte main criticism
79_8	taught sociology auguste comte main criticism auguste comte compare conflict theory
79_9	taught sociology auguste comte compare conflict theory modern examples conflict theory
80_1	purposes lewis clark expedition
80_2	purposes lewis clark expedition important plants animals discovered
80_3	purposes lewis clark expedition important plants animals discovered diplomatic objectives
80_4	purposes lewis clark expedition diplomatic objectives native american tribes encountered
80_5	purposes lewis clark expedition native american tribes encountered sacagawea
80_6	purposes lewis clark expedition sacagawea find northwest passage
80_7	purposes lewis clark expedition find northwest passage purpose sacagawea
80_8	purposes lewis clark expedition purpose sacagawea spend winter
80_9	purposes lewis clark expedition spend winter happened sacagawea
80_10	purposes lewis clark expedition happened sacagawea impact expedition
