31_1	throat cancer
31_2	throat cancer throat cancer treatable
31_3	throat cancer throat cancer treatable lung cancer
31_4	throat cancer lung cancer lung cancer symptoms
31_5	throat cancer lung cancer symptoms lung cancer spread throat cancer
31_6	throat cancer lung cancer spread throat cancer throat cancer
31_7	throat cancer throat cancer sign throat cancer
31_8	throat cancer sign throat cancer throat cancer esophageal cancer
31_9	throat cancer throat cancer esophageal cancer difference lung cancer symptoms
32_1	types sharks
32_2	types sharks sharks endangered species
32_3	types sharks sharks endangered species tiger sharks
32_4	types sharks tiger sharks largest lived earth
32_5	types sharks largest lived earth largest caught
32_6	types sharks largest caught great whites
32_7	types sharks great whites makos
32_8	types sharks makos makos
32_9	types sharks makos makos live
32_10	types sharks makos live makos eat
32_11	types sharks makos eat makos compare tigers dangerous
33_1	neverending story film
33_2	neverending story film neverending story film
33_3	neverending story film neverending story film neverending story film received
33_4	neverending story film neverending story film received neverending story film win awards
33_5	neverending story film neverending story film win awards neverending story film book
33_6	neverending story film neverending story film book book book published
33_7	neverending story film book book published main themes
33_8	neverending story film main themes main characters
33_9	neverending story film main characters differences neverending story film movies
33_10	neverending story film differences neverending story film movies neverending story film die
34_1	bronze age collapse
34_2	bronze age collapse evidence bronze age collapse
34_3	bronze age collapse evidence bronze age collapse null
34_4	bronze age collapse null sea peoples
34_5	bronze age collapse sea peoples sea peoples role bronze age collapse
34_6	bronze age collapse sea peoples role bronze age collapse factors led breakdown trade
34_7	bronze age collapse factors led breakdown trade environmental factors
34_8	bronze age collapse environmental factors empires survived
34_9	bronze age collapse empires survived bronze age collapse
35_1	history toilets
35_2	history toilets term
35_3	history toilets term invented
35_4	history toilets invented brits call term loo
35_5	history toilets brits call term loo brits
35_6	history toilets brits indoor versions common
35_7	history toilets indoor versions common types
35_8	history toilets types indoor versions important society
35_9	history toilets indoor versions important society indoor versions role film
36_1	electoral college
36_2	electoral college electoral college work
36_3	electoral college electoral college work electoral college creation
36_4	electoral college electoral college creation system chosen
36_5	electoral college system chosen electoral college changed time
36_6	electoral college electoral college changed time electors nt vote pledged candidate
36_7	electoral college electors nt vote pledged candidate changed election outcomes
36_8	electoral college changed election outcomes hamilton electors hamilton electors
36_9	electoral college hamilton electors hamilton electors electoral college abolished
36_10	electoral college electoral college abolished national popular vote interstate compact work
36_11	electoral college national popular vote interstate compact work legal
37_1	stanford experiment
37_2	stanford experiment stanford experiment show
37_3	stanford experiment stanford experiment show author experiment
37_4	stanford experiment author experiment experiment ethical
37_5	stanford experiment experiment ethical similar experiments
37_6	stanford experiment similar experiments happened experiment stanford experiment
37_7	stanford experiment happened experiment stanford experiment experiment important
37_8	stanford experiment experiment important similarities differences studies
37_9	stanford experiment similarities differences studies experiment
37_10	stanford experiment experiment key findings
37_11	stanford experiment key findings key findings differ
37_12	stanford experiment key findings differ experiment ended
38_1	lyme disease
38_2	lyme disease lyme disease
38_3	lyme disease lyme disease make feel
38_4	lyme disease make feel untreated
38_5	lyme disease untreated kill
38_6	lyme disease kill reliable test
38_7	lyme disease reliable test test cured
38_8	lyme disease test cured lyme disease
39_1	vegan
39_2	vegan environmental argument
39_3	vegan environmental argument milk strong bones
39_4	vegan milk strong bones good sources calcium
39_5	vegan good sources calcium nt eat meat bad
39_6	vegan nt eat meat bad good sources vitamin b12
39_7	vegan good sources vitamin b12 lose weight
39_8	vegan lose weight health effects versus vegetarian
39_9	vegan health effects versus vegetarian environmental impact compare
40_1	origins popular music
40_2	origins popular music popular music characteristics
40_3	origins popular music popular music characteristics technological developments enabled popular music
40_4	origins popular music technological developments enabled popular music people start taking pop
40_5	origins popular music people start taking pop popular music integrated music education
40_6	origins popular music popular music integrated music education describe influential pop bands
40_7	origins popular music describe influential pop bands makes song pop punk
40_8	origins popular music makes song pop punk difference song pop punk emo
40_9	origins popular music difference song pop punk emo britpop change music
40_10	origins popular music britpop change music popular music roots influenced popular music
41_1	drinking age 21 18
41_2	drinking age 21 18 pros cons
41_3	drinking age 21 18 pros cons negative health effects drinking
41_4	drinking age 21 18 negative health effects drinking binge drinking affect development
41_5	drinking age 21 18 binge drinking affect development damage mental health
41_6	drinking age 21 18 damage mental health short long term effects usage brain chemicals
41_7	drinking age 21 18 short long term effects usage brain chemicals alcoholics generally depressed
41_8	drinking age 21 18 alcoholics generally depressed effects vitamins minerals
41_9	drinking age 21 18 effects vitamins minerals benefits
42_1	chattanooga famous
42_2	chattanooga famous downtown chattanooga
42_3	chattanooga famous downtown chattanooga tourism activities related trucks trains
42_4	chattanooga famous tourism activities related trucks trains related bessie smith
42_5	chattanooga famous related bessie smith visit nearby distilleries
42_6	chattanooga famous visit nearby distilleries rock city famous
42_7	chattanooga famous rock city famous special events held
42_8	chattanooga famous special events held kind food chattanooga
43_1	interesting things ann arbor
43_2	interesting things ann arbor ann arbor founded
43_3	interesting things ann arbor ann arbor founded ann arbor relate establishment university
43_4	interesting things ann arbor ann arbor relate establishment university museum art special collections
43_5	interesting things ann arbor museum art special collections south pond nature area
43_6	interesting things ann arbor south pond nature area film festivals
43_7	interesting things ann arbor film festivals jazz
43_8	interesting things ann arbor jazz popular bars clubs listen south pond nature area
44_1	acidic reflux morning
44_2	acidic reflux morning long term side effects
44_3	acidic reflux morning long term side effects otc
44_4	acidic reflux morning otc side effects long term ppi
44_5	acidic reflux morning side effects long term ppi natural treatments
44_6	acidic reflux morning natural treatments foods natural treatments
44_7	acidic reflux morning foods natural treatments reduce natural treatments
44_8	acidic reflux morning reduce natural treatments exercise affect natural treatments
45_1	dog breed playing
45_2	dog breed playing kind allergic
45_3	dog breed playing kind allergic big active dogs
45_4	dog breed playing big active dogs big dogs live longer small dogs
45_5	dog breed playing big dogs live longer small dogs put lot time training
45_6	dog breed playing put lot time training breeds independent left home day
45_7	dog breed playing breeds independent left home day irish wolfhound weigh
45_8	dog breed playing irish wolfhound weigh irish wolfhound cost
46_1	learning language difficult
46_2	learning language difficult age harder
46_3	learning language difficult age harder english language easiest learn
46_4	learning language difficult english language easiest learn begin learning norwegian
46_5	learning language difficult begin learning norwegian easier learn spanish
46_6	learning language difficult easier learn spanish languages closest norwegian
46_7	learning language difficult languages closest norwegian describe norwegian similarities danish
46_8	learning language difficult describe norwegian similarities danish languages evolve
46_9	learning language difficult languages evolve related danish
46_10	learning language difficult related danish advantages knowing multiple languages
47_1	boise called city trees
47_2	boise called city trees null
47_3	boise called city trees null summer
47_4	boise called city trees summer popular hiking trails
47_5	boise called city trees popular hiking trails oregon trail reserve
47_6	boise called city trees oregon trail reserve history boise greenbelt
47_7	boise called city trees history boise greenbelt controversy history boise greenbelt
48_1	main function virtual machine
48_2	main function virtual machine virtual machine advantages
48_3	main function virtual machine virtual machine advantages describe virtual machine disadvantages
48_4	main function virtual machine describe virtual machine disadvantages work
48_5	main function virtual machine work main types vms
48_6	main function virtual machine main types vms role cloud computing
48_7	main function virtual machine role cloud computing container
48_8	main function virtual machine container advantage vms
48_9	main function virtual machine advantage vms advantage vms related vms
49_1	netflix started
49_2	netflix started netflix originally work
49_3	netflix started netflix originally work netflix relationship blockbuster
49_4	netflix started netflix relationship blockbuster netflix shift dvds streaming service
49_5	netflix started netflix shift dvds streaming service dvds competitors
49_6	netflix started dvds competitors dvds compare amazon prime video
49_7	netflix started dvds compare amazon prime video describe dvds subscriber growth time
49_8	netflix started describe dvds subscriber growth time dvds changed tv watched
49_9	netflix started dvds changed tv watched dvds impacted society
49_10	netflix started dvds impacted society dating relationships
50_1	artificial satellite
50_2	artificial satellite types orbits
50_3	artificial satellite types orbits important classes satellite
50_4	artificial satellite important classes satellite navigation systems work
50_5	artificial satellite navigation systems work galileo system galileo system important
50_6	artificial satellite galileo system galileo system important galileo system create tension
50_7	artificial satellite galileo system create tension cubesats
50_8	artificial satellite cubesats cubesats advantages
50_9	artificial satellite cubesats advantages cubesats
50_10	artificial satellite cubesats cubesats future
51_1	save child college education
51_2	save child college education 529 plan
51_3	save child college education 529 plan 529 plan work
51_4	save child college education 529 plan work main advantages
51_5	save child college education main advantages disadvantages
51_6	save child college education disadvantages long main advantages
51_7	save child college education long main advantages types plans
51_8	save child college education types plans funds
51_9	save child college education funds 529 plan
51_10	save child college education 529 plan esa compare
52_1	describe afra tanker scale
52_2	describe afra tanker scale developed
52_3	describe afra tanker scale developed supertankers
52_4	describe afra tanker scale supertankers describe invention
52_5	describe afra tanker scale describe invention important factors led important factors development
52_6	describe afra tanker scale important factors led important factors development role day war
52_7	describe afra tanker scale role day war barrels vlcc ship carry
52_8	describe afra tanker scale barrels vlcc ship carry largest world
52_9	describe afra tanker scale largest world problem increased scale create
52_10	describe afra tanker scale problem increased scale create describe crude oil washing
53_1	red bull bad
53_2	red bull bad kill
53_3	red bull bad kill drink day
53_4	red bull bad drink day taurine
53_5	red bull bad taurine health effects
53_6	red bull bad health effects general effects consuming energy drinks
53_7	red bull bad general effects consuming energy drinks consuming energy drinks harmful mixed alcohol
53_8	red bull bad consuming energy drinks harmful mixed alcohol argument consuming energy drinks age restriction kids
53_9	red bull bad argument consuming energy drinks age restriction kids consuming energy drinks banned minors
54_1	worth washington dc
54_2	worth washington dc smithsonian museums popular
54_3	worth washington dc smithsonian museums popular national air space museum important
54_4	worth washington dc national air space museum important spy museum free
54_5	worth washington dc spy museum free dc smithsonian museums close
54_6	worth washington dc dc smithsonian museums close time visit reflecting pools
54_7	worth washington dc time visit reflecting pools famous foods
54_8	worth washington dc famous foods dc half smoke
54_9	worth washington dc dc half smoke dc half smoke history
55_1	describe oceanic crust
55_2	describe oceanic crust main layers
55_3	describe oceanic crust main layers main layers differ continental crust
55_4	describe oceanic crust main layers differ continental crust younger
55_5	describe oceanic crust younger youngest oceanic found
55_6	describe oceanic crust youngest oceanic found oldest
55_7	describe oceanic crust oldest seafloor spreading
55_8	describe oceanic crust seafloor spreading oldest significance
55_9	describe oceanic crust oldest significance ocean crust formed
55_10	describe oceanic crust ocean crust formed oldest recycled
56_1	darwin theory nutshell
56_2	darwin theory nutshell darwin developed
56_3	darwin theory nutshell darwin developed sexual asexual reproduction affect darwin
56_4	darwin theory nutshell sexual asexual reproduction affect darwin fossils understand darwin
56_5	darwin theory nutshell fossils understand darwin modern evidence darwin
56_6	darwin theory nutshell modern evidence darwin impact modern biology
56_7	darwin theory nutshell impact modern biology compare contrast microevolution macroevolution
56_8	darwin theory nutshell compare contrast microevolution macroevolution relationship speciation
57_1	suffering depression
57_2	suffering depression common types
57_3	suffering depression common types depression
57_4	suffering depression depression role brain chemicals
57_5	suffering depression role brain chemicals lack sunlight depression
57_6	suffering depression lack sunlight depression treat
57_7	suffering depression treat role
57_8	suffering depression role anxiety depression related
57_9	suffering depression anxiety depression related treatments exist depression
57_10	suffering depression treatments exist depression depression work
58_1	real time database
58_2	real time database real time database differ traditional
58_3	real time database real time database differ traditional advantages real time processing
58_4	real time database advantages real time processing examples important
58_5	real time database examples important important applications
58_6	real time database important applications important cloud options
58_7	real time database important cloud options firebase db
58_8	real time database firebase db firebase db mobile apps
59_1	weekend sports injuries
59_2	weekend sports injuries common types injuries
59_3	weekend sports injuries common types injuries acl
59_4	weekend sports injuries acl injury acl
59_5	weekend sports injuries injury acl acl method
59_6	weekend sports injuries acl method disagreement acl method
59_7	weekend sports injuries disagreement acl method acl
59_8	weekend sports injuries acl ways avoid injury
60_1	benefits yoga
60_2	benefits yoga benefits yoga reducing stress
60_3	benefits yoga benefits yoga reducing stress main types
60_4	benefits yoga main types type losing weight
60_5	benefits yoga type losing weight common poses bikram yoga
60_6	benefits yoga common poses bikram yoga mindful breathing important
60_7	benefits yoga mindful breathing important benefits yoga relieve asthma
61_1	avengers
61_2	avengers avengers appearance
61_3	avengers avengers appearance powerful
61_4	avengers powerful relationship spider man team
61_5	avengers relationship spider man team avengers member
61_6	avengers avengers member important team dc universe
61_7	avengers important team dc universe origins justice league
61_8	avengers origins justice league important members
61_9	avengers important members team
62_1	surrealism movement art
62_2	surrealism movement art surrealism movement art characteristics
62_3	surrealism movement art surrealism movement art characteristics surrealism movement art founding
62_4	surrealism movement art surrealism movement art founding series manifestos
62_5	surrealism movement art series manifestos dada
62_6	surrealism movement art dada surrealism movement art importance
62_7	surrealism movement art surrealism movement art importance famous artists
62_8	surrealism movement art famous artists dali choose surrealism
62_9	surrealism movement art dali choose surrealism dali iconic works
62_10	surrealism movement art dali iconic works surrealism movement art today
62_11	surrealism movement art surrealism movement art today surrealism movement art impact fields
63_1	blockchain
63_2	blockchain problem blockchain solve
63_3	blockchain problem blockchain solve blockchain work
63_4	blockchain blockchain work types networks
63_5	blockchain types networks blockchain invention
63_6	blockchain blockchain invention blockchain related cryptocurrencies
63_7	blockchain blockchain related cryptocurrencies blockchain generated
63_8	blockchain blockchain generated secure blockchain
63_9	blockchain secure blockchain blockchain business
63_10	blockchain blockchain business implications society
64_1	types pork ribs
64_2	types pork ribs baby backs
64_3	types pork ribs baby backs differences spareribs
64_4	types pork ribs differences spareribs ways cook baby backs
64_5	types pork ribs ways cook baby backs spareribs
64_6	types pork ribs spareribs describe 321 method
64_7	types pork ribs describe 321 method long smoke
64_8	types pork ribs long smoke null
64_9	types pork ribs null typical rub
64_10	types pork ribs typical rub style sauce
64_11	types pork ribs style sauce kansas city style sauce
65_1	nominal gdp
65_2	nominal gdp nominal gdp good measure
65_3	nominal gdp nominal gdp good measure difference real
65_4	nominal gdp difference real nominal gdp related gross national income
65_5	nominal gdp nominal gdp related gross national income meaning gni
65_6	nominal gdp meaning gni inflation affected high nominal gdp growth
65_7	nominal gdp inflation affected high nominal gdp growth relationship inflation unemployment
65_8	nominal gdp relationship inflation unemployment frictional unemployment frictional unemployment important
65_9	nominal gdp frictional unemployment frictional unemployment important bad economy
65_10	nominal gdp bad economy government reduce government level
66_1	lavender plants
66_2	lavender plants types
66_3	lavender plants types places famous types
66_4	lavender plants places famous types places safe eat
66_5	lavender plants places safe eat variety cooking
66_6	lavender plants variety cooking cooking
66_7	lavender plants cooking cooking good
66_8	lavender plants cooking good health benefits cooking oil
66_9	lavender plants health benefits cooking oil side effects
67_1	blood red
67_2	blood red red blood cells
67_3	blood red red blood cells red blood cells created
67_4	blood red red blood cells created oxygen transported
67_5	blood red oxygen transported anemia
67_6	blood red anemia symptoms
67_7	blood red symptoms anemia
67_8	blood red anemia anemia
67_9	blood red anemia anemia treated
67_10	blood red anemia treated foods high levels iron
67_11	blood red foods high levels iron improves absorption
68_1	cuisine emilia romagna famous
68_2	cuisine emilia romagna famous cooking schools classes
68_3	cuisine emilia romagna famous cooking schools classes famous foods region
68_4	cuisine emilia romagna famous famous foods region describe traditional process making balsamic vinegar
68_5	cuisine emilia romagna famous describe traditional process making balsamic vinegar mortadella balsamic vinegar
68_6	cuisine emilia romagna famous mortadella balsamic vinegar difference balsamic vinegar
68_7	cuisine emilia romagna famous difference balsamic vinegar balsamic vinegar cheese created
68_8	cuisine emilia romagna famous balsamic vinegar cheese created balsamic vinegar production
68_9	cuisine emilia romagna famous balsamic vinegar production typical pasta dishes
68_10	cuisine emilia romagna famous typical pasta dishes history tagliatelle al ragu bolognese
68_11	cuisine emilia romagna famous history tagliatelle al ragu bolognese history tagliatelle al ragu bolognese common variations
69_1	sleep jet lag
69_2	sleep jet lag melatonin
69_3	sleep jet lag melatonin jet lag discovered
69_4	sleep jet lag jet lag discovered good sources food
69_5	sleep jet lag good sources food melatonin bad
69_6	sleep jet lag melatonin bad side effects
69_7	sleep jet lag side effects side effects require prescription uk
69_8	sleep jet lag side effects require prescription uk increase levels naturally
69_9	sleep jet lag increase levels naturally side effects effective treating insomnia
69_10	sleep jet lag side effects effective treating insomnia anxiety
70_1	solar energy
70_2	solar energy solar energy main
70_3	solar energy solar energy main solar energy important
70_4	solar energy solar energy important advantages solar energy
70_5	solar energy advantages solar energy cost solar power
70_6	solar energy cost solar power rural africa
70_7	solar energy rural africa solar cookers work
70_8	solar energy solar cookers work solar power architecture
70_9	solar energy solar power architecture important projects
70_10	solar energy important projects solar power power cars
71_1	mammals
71_2	mammals key characteristics
71_3	mammals key characteristics legs
71_4	mammals legs largest land
71_5	mammals largest land largest world
71_6	mammals largest world uk
71_7	mammals uk largest land walk world
71_8	mammals largest land walk world blue whales
71_9	mammals blue whales blue whales weigh
71_10	mammals blue whales weigh blue whales live
71_11	mammals blue whales live blue whales eat
71_12	mammals blue whales eat blue whales
72_1	spanish people christmas day
72_2	spanish people christmas day spanish people eat dinner
72_3	spanish people christmas day spanish people eat dinner christmas day
72_4	spanish people christmas day christmas day christmas lottery
72_5	spanish people christmas day christmas lottery drawing work
72_6	spanish people christmas day drawing work tickets sold
72_7	spanish people christmas day tickets sold christmas lottery
72_8	spanish people christmas day christmas lottery christmas lottery start
72_9	spanish people christmas day christmas lottery start tickets celebrate kings day
72_10	spanish people christmas day tickets celebrate kings day cakes traditional
73_1	successful pirate time
73_2	successful pirate time famous female
73_3	successful pirate time famous female ching shih
73_4	successful pirate time ching shih ching shih code laws
73_5	successful pirate time ching shih code laws ching shih die
73_6	successful pirate time ching shih die anne bonny
73_7	successful pirate time anne bonny anne bonny famous
73_8	successful pirate time anne bonny famous anne bonny married
73_9	successful pirate time anne bonny married anne bonny die
73_10	successful pirate time anne bonny die happened anne bonny
74_1	pros cons electric cars
74_2	pros cons electric cars tesla
74_3	pros cons electric cars tesla elon musk start tesla
74_4	pros cons electric cars elon musk start tesla models
74_5	pros cons electric cars models selling
74_6	pros cons electric cars selling unique tesla 3
74_7	pros cons electric cars unique tesla 3 safety features
74_8	pros cons electric cars safety features selling building tesla
74_9	pros cons electric cars selling building tesla makes batteries unique
74_10	pros cons electric cars makes batteries unique long safety features
74_11	pros cons electric cars long safety features autopilot
74_12	pros cons electric cars autopilot selling support full driving
75_1	turkey turkey share
75_2	turkey turkey share turkeys
75_3	turkey turkey share turkeys turkey turkey importance native cultures
75_4	turkey turkey share turkey turkey importance native cultures turkey turkey domesticated
75_5	turkey turkey share turkey turkey domesticated turkey turkey fly
75_6	turkey turkey share turkey turkey fly ben franklin national symbol
75_7	turkey turkey share ben franklin national symbol ben franklin cook
75_8	turkey turkey share ben franklin cook eaten thanksgiving
75_9	turkey turkey share eaten thanksgiving traditional christmas dinner britain
75_10	turkey turkey share traditional christmas dinner britain turkey turkey popular
76_1	important literary elements
76_2	important literary elements difference important literary elements literary devices
