74_3	Why did Elon Musk start  tesla ?  the pros electric cars
74_4	What models are available ?  tesla  the pros electric cars
74_5	What is the best selling ?  tesla  the pros electric cars
74_6	What is unique about the Model 3 ?  tesla  the pros electric cars
74_7	What are the safety features ?  tesla  the pros electric cars
74_8	Why is  tesla building Gigafactories ?  the pros electric cars
74_9	What makes the batteries unique ?  tesla  the pros electric cars
74_10	How long can  tesla last ?  the pros electric cars
74_11	Tell me more about autopilot .  the pros electric cars
74_12	Does  autopilot support full self - driving ?  the pros electric cars
75_1	Why do turkey and Turkey share the same name ? 
75_2	Where are turkeys from ?  turkey the same name 
75_3	What was  turkey the same name importance in native cultures ? 
75_4	When and how were  turkey the same name domesticated ? 
75_5	Can  turkey the same name fly ? 
75_6	Why did Ben Franklin want  turkey the same name to be the national symbol ? 
75_7	How did  turkey the same name cook  turkey the same name ? 
75_8	Why is  turkey the same name eaten on Thanksgiving ? 
75_9	How did  turkey the same name become traditional for Christmas dinner in Britain ? 
75_10	When did  turkey the same name become popular ? 
76_1	What are important literary elements ? 
76_2	What is the difference between What important literary elements  and literary devices ? 
76_3	What is a genre ? What important literary elements  
76_4	What are the most important ones ? What important literary elements  
76_5	What is a trope ? What important literary elements  
76_6	What are important examples in fantasy ? What important literary elements  
76_7	What is the definition of allegory ? What important literary elements  
76_8	What are some important modern uses ? What important literary elements  
76_9	What are the different types of foreshadowing ? What important literary elements  
76_10	What is an example ? What important literary elements  
77_1	What 's the difference between soup and stew ? 
77_2	Is chilli a stew ?  the difference soup 
77_3	How about goulash ?  the difference soup 
77_4	What are popular ones in France ?  the difference soup 
77_5	How is cassoulet made ?  the difference soup 
77_6	Tell me about feijoada and  the difference soup significance . 
77_7	How is  the difference soup similar or different from cassoulet ? 
77_8	Tell about Bigos stew .  the difference soup 
77_9	Why is  the difference soup important ? 
77_10	What is the history of Irish stew ?  the difference soup 
78_1	What is the keto diet ? 
78_2	Why was  the keto diet original developed ? 
78_3	What is ketosis ?  the keto diet 
78_4	What is paleo ?  the keto diet 
78_5	What do  the keto diet have in common ? 
78_6	How are  the keto diet different ? 
78_7	What is intermittent fasting ?  the keto diet 
78_8	How is  the keto diet related to keto ? 
78_9	What is the 16/8 method ?  the keto diet 
78_10	What is the best for weight loss ?  the keto diet 
79_1	What is taught in sociology ? 
79_2	What is the main contribution of Auguste Comte ?  sociology 
79_3	What is the role of positivism in  sociology ? 
79_4	What is Herbert Spencer known for ?  sociology 
79_5	How is  sociology work related to Comte ? 
79_6	What is the functionalist theory ?  sociology 
79_7	What is  sociology main criticism ? 
79_8	How does  sociology compare to conflict theory ? 
79_9	What are modern examples of conflict theory ?  sociology 
80_1	What were the purposes of the Lewis and Clark expedition ? 
80_2	What were important plants and animals  the purposes the Lewis and Clark expedition discovered ? 
80_3	What were the diplomatic objectives ?  the purposes the Lewis and Clark expedition 
80_4	What were the Native American tribes that  the purposes the Lewis and Clark expedition encountered ? 
80_5	How did Sacagawea help  the purposes the Lewis and Clark expedition ? 
80_6	Did  the purposes the Lewis and Clark expedition find the Northwest Passage ? 
80_7	What was the purpose of Fort Mandan ?  the purposes the Lewis and Clark expedition 
80_8	How did  the purposes the Lewis and Clark expedition spend the next winter ? 
80_9	What happened to Fort Clatsop ?  the purposes the Lewis and Clark expedition 
80_10	What was the impact of the expedition ?  the purposes the Lewis and Clark expedition 
